[
  {
    "id": 2860,
    "date": "2026-07-22T17:07:17",
    "date_gmt": "2026-07-22T09:07:17",
    "guid": {
      "rendered": "https://www.ukm.my/portal/?page_id=2860"
    },
    "modified": "2026-07-27T13:14:52",
    "modified_gmt": "2026-07-27T05:14:52",
    "slug": "hubungi-kami",
    "status": "publish",
    "type": "page",
    "link": "https://www.ukm.my/portal/ms/hubungi-kami/",
    "title": {
      "rendered": "Hubungi Kami"
    },
    "content": {
      "rendered": "\u2026elided\u2026",
      "protected": false
    },
    "excerpt": {
      "rendered": "\u2026elided\u2026",
      "protected": false
    },
    "author": 1,
    "featured_media": 0,
    "parent": 0,
    "menu_order": 0,
    "comment_status": "closed",
    "ping_status": "closed",
    "template": "",
    "meta": {
      "footnotes": ""
    },
    "class_list": [
      "post-2860",
      "page",
      "type-page",
      "status-publish",
      "hentry"
    ],
    "_links": {
      "self": [
        {
          "href": "https://www.ukm.my/portal/wp-json/wp/v2/pages/2860",
          "targetHints": {
            "allow": [
              "GET"
            ]
          }
        }
      ],
      "collection": [
        {
          "href": "https://www.ukm.my/portal/wp-json/wp/v2/pages"
        }
      ],
      "about": [
        {
          "href": "https://www.ukm.my/portal/wp-json/wp/v2/types/page"
        }
      ],
      "author": [
        {
          "embeddable": true,
          "href": "https://www.ukm.my/portal/wp-json/wp/v2/users/1"
        }
      ],
      "replies": [
        {
          "embeddable": true,
          "href": "https://www.ukm.my/portal/wp-json/wp/v2/comments?post=2860"
        }
      ],
      "version-history": [
        {
          "count": 22,
          "href": "https://www.ukm.my/portal/wp-json/wp/v2/pages/2860/revisions"
        }
      ],
      "predecessor-version": [
        {
          "id": 3852,
          "href": "https://www.ukm.my/portal/wp-json/wp/v2/pages/2860/revisions/3852"
        }
      ],
      "wp:attachment": [
        {
          "href": "https://www.ukm.my/portal/wp-json/wp/v2/media?parent=2860"
        }
      ],
      "curies": [
        {
          "name": "wp",
          "href": "https://api.w.org/{rel}",
          "templated": true
        }
      ]
    }
  }
]